{
  "$schema": "schemas/debug-filters.schema.json",
  "$comment": [
    "Bead's debug filters: what a filter reads as, which calls and envelopes it keeps, or why a side refuses it, and what a filter given as a function does from event to event (spec/debugging.md, section 6; decision 0013).",
    "calls are the fixtures a call's filter is asked of: a trace's event, by its direction, its type and its procedure's name. envelopes are those an envelope's filter is asked of: a router's event, by its direction and its kind, named as section 3.1 of spec.md names it, in lower case. An entry names a fixture by its index.",
    "filter is a filter as written. parsed is what it reads as (6.6): its directions, its types and its kinds, by the grammar's names, and include, its patterns, and exclude, its exclusions without their -, as written, each in the order of its words. keeps lists the calls a call's listener given the filter hears, and the envelopes an envelope's listener hears, in their order.",
    "refused, in place of parsed and keeps, is why a side refuses the filter (6.7): reason, the first word that does not hold, and written, the word or the value it names, as it was written. The words of a refusal are each side's own, and stay with its tests.",
    "sources are filters given as functions (6.9). listener says whose listener the function filters, a call's or an envelope's. A step gives a filter, which the function gives from then on, or null, none, which keeps every event; throws, from then on the function throws; made, the listener is made with the function, which is asked then, and true or false says whether it is made; event, an event of that fixture goes through the listener, which asks the function again, and heard says whether the listener heard it.",
    "clauses are the units of spec/debugging.md an entry checks: a clause, 6.7; a row of its table, counted from 1, 6.7.3.",
    "Every character outside printable ASCII is written as its JSON escape."
  ],
  "debuggingVersion": "0.3.0",
  "calls": [
    {
      "direction": "tx",
      "type": "request",
      "procedureName": "getStatus"
    },
    {
      "direction": "rx",
      "type": "request",
      "procedureName": "getStatus"
    },
    {
      "direction": "rx",
      "type": "request",
      "procedureName": "GetTime"
    },
    {
      "direction": "tx",
      "type": "command",
      "procedureName": "ping"
    },
    {
      "direction": "rx",
      "type": "notification",
      "procedureName": "news"
    },
    {
      "direction": "tx",
      "type": "request",
      "procedureName": "a\rb"
    },
    {
      "direction": "tx",
      "type": "request",
      "procedureName": "a\u2028b"
    },
    {
      "direction": "rx",
      "type": "request",
      "procedureName": "key"
    },
    {
      "direction": "rx",
      "type": "request",
      "procedureName": "\u212aey"
    },
    {
      "direction": "rx",
      "type": "request",
      "procedureName": "\u0130d"
    },
    {
      "direction": "rx",
      "type": "request",
      "procedureName": "a\u0085b"
    },
    {
      "direction": "rx",
      "type": "request",
      "procedureName": ""
    },
    {
      "direction": "rx",
      "type": "request",
      "procedureName": "a.b"
    },
    {
      "direction": "rx",
      "type": "request",
      "procedureName": "axb"
    },
    {
      "direction": "rx",
      "type": "request",
      "procedureName": "caf\u00e9"
    },
    {
      "direction": "tx",
      "type": "request",
      "procedureName": "a\nb"
    }
  ],
  "envelopes": [
    {
      "direction": "tx",
      "kind": "request"
    },
    {
      "direction": "rx",
      "kind": "result"
    },
    {
      "direction": "rx",
      "kind": "failure"
    },
    {
      "direction": "tx",
      "kind": "cancel"
    },
    {
      "direction": "rx",
      "kind": "notification"
    },
    {
      "direction": "tx",
      "kind": "chunk"
    },
    {
      "direction": "rx",
      "kind": "credit"
    }
  ],
  "filters": [
    {
      "name": "an empty filter keeps every call and every envelope",
      "clauses": [
        "6.5"
      ],
      "filter": "",
      "parsed": {
        "directions": [],
        "types": [],
        "kinds": [],
        "include": [],
        "exclude": []
      },
      "keeps": {
        "calls": [
          0,
          1,
          2,
          3,
          4,
          5,
          6,
          7,
          8,
          9,
          10,
          11,
          12,
          13,
          14,
          15
        ],
        "envelopes": [
          0,
          1,
          2,
          3,
          4,
          5,
          6
        ]
      }
    },
    {
      "name": "separators alone are an empty filter",
      "clauses": [
        "6.1",
        "6.2",
        "6.5"
      ],
      "filter": " ,\t\n\u000b\f\r",
      "parsed": {
        "directions": [],
        "types": [],
        "kinds": [],
        "include": [],
        "exclude": []
      },
      "keeps": {
        "calls": [
          0,
          1,
          2,
          3,
          4,
          5,
          6,
          7,
          8,
          9,
          10,
          11,
          12,
          13,
          14,
          15
        ],
        "envelopes": [
          0,
          1,
          2,
          3,
          4,
          5,
          6
        ]
      }
    },
    {
      "name": "a comma and each of the six ASCII white spaces part two words",
      "clauses": [
        "6.1",
        "6.2",
        "6.6"
      ],
      "filter": "getStatus,ping news\tkey\nGetTime\u000baxb\fa.b\rcaf\u00e9",
      "parsed": {
        "directions": [],
        "types": [],
        "kinds": [],
        "include": [
          "getStatus",
          "ping",
          "news",
          "key",
          "GetTime",
          "axb",
          "a.b",
          "caf\u00e9"
        ],
        "exclude": []
      },
      "keeps": {
        "calls": [
          0,
          1,
          2,
          3,
          4,
          7,
          12,
          13,
          14
        ],
        "envelopes": [
          0,
          1,
          2,
          3,
          4,
          5,
          6
        ]
      }
    },
    {
      "name": "a run of separators parts two words once",
      "clauses": [
        "6.1",
        "6.2"
      ],
      "filter": ", ping ,\t, news ,",
      "parsed": {
        "directions": [],
        "types": [],
        "kinds": [],
        "include": [
          "ping",
          "news"
        ],
        "exclude": []
      },
      "keeps": {
        "calls": [
          3,
          4
        ],
        "envelopes": [
          0,
          1,
          2,
          3,
          4,
          5,
          6
        ]
      }
    },
    {
      "name": "a next line, U+0085, parts no two words",
      "clauses": [
        "6.2",
        "6.6"
      ],
      "filter": "a\u0085b",
      "parsed": {
        "directions": [],
        "types": [],
        "kinds": [],
        "include": [
          "a\u0085b"
        ],
        "exclude": []
      },
      "keeps": {
        "calls": [
          10
        ],
        "envelopes": [
          0,
          1,
          2,
          3,
          4,
          5,
          6
        ]
      }
    },
    {
      "name": "a byte order mark, U+FEFF, parts no two words",
      "clauses": [
        "6.2",
        "6.6"
      ],
      "filter": "getStatus\ufeffping",
      "parsed": {
        "directions": [],
        "types": [],
        "kinds": [],
        "include": [
          "getStatus\ufeffping"
        ],
        "exclude": []
      },
      "keeps": {
        "calls": [],
        "envelopes": [
          0,
          1,
          2,
          3,
          4,
          5,
          6
        ]
      }
    },
    {
      "name": "a no-break space, U+00A0, parts no two words",
      "clauses": [
        "6.2",
        "6.6"
      ],
      "filter": "getStatus\u00a0ping",
      "parsed": {
        "directions": [],
        "types": [],
        "kinds": [],
        "include": [
          "getStatus\u00a0ping"
        ],
        "exclude": []
      },
      "keeps": {
        "calls": [],
        "envelopes": [
          0,
          1,
          2,
          3,
          4,
          5,
          6
        ]
      }
    },
    {
      "name": "a line separator, U+2028, parts no two words",
      "clauses": [
        "6.2",
        "6.6"
      ],
      "filter": "getStatus\u2028ping",
      "parsed": {
        "directions": [],
        "types": [],
        "kinds": [],
        "include": [
          "getStatus\u2028ping"
        ],
        "exclude": []
      },
      "keeps": {
        "calls": [],
        "envelopes": [
          0,
          1,
          2,
          3,
          4,
          5,
          6
        ]
      }
    },
    {
      "name": "d(rx) keeps the calls and the envelopes that come in",
      "clauses": [
        "6.3",
        "6.5"
      ],
      "filter": "d(rx)",
      "parsed": {
        "directions": [
          "rx"
        ],
        "types": [],
        "kinds": [],
        "include": [],
        "exclude": []
      },
      "keeps": {
        "calls": [
          1,
          2,
          4,
          7,
          8,
          9,
          10,
          11,
          12,
          13,
          14
        ],
        "envelopes": [
          1,
          2,
          4,
          6
        ]
      }
    },
    {
      "name": "a selector's letter and its values are read in either case",
      "clauses": [
        "6.1",
        "6.3"
      ],
      "filter": "D(TX)",
      "parsed": {
        "directions": [
          "tx"
        ],
        "types": [],
        "kinds": [],
        "include": [],
        "exclude": []
      },
      "keeps": {
        "calls": [
          0,
          3,
          5,
          6,
          15
        ],
        "envelopes": [
          0,
          3,
          5